{
  "catalog_version": "1.5",
  "supported_project_schemas": [
    "1.5"
  ],
  "schema_inheritance": {
    "1.2": "1.1",
    "1.3": "1.2",
    "1.4": "1.3",
    "1.5": "1.4"
  },
  "identifier_prefixes": [
    "OBJ",
    "STK",
    "USR",
    "CON",
    "FR",
    "NFR",
    "TR",
    "BR",
    "AC",
    "ADR",
    "INT",
    "DATA",
    "SEC",
    "PRIV",
    "UX",
    "VIS",
    "INC",
    "RISK",
    "DEP",
    "DEV",
    "TEST",
    "EVID",
    "OPEN",
    "PLAN",
    "TASK",
    "REL",
    "UNIT",
    "BIND",
    "CHG",
    "ENV",
    "PCH",
    "CKPT",
    "AUTH",
    "EXEC",
    "TRK",
    "SYNC",
    "RPT"
  ],
  "reference_grammar": {
    "canonical_range": "..",
    "list_separators": [
      ",",
      ";"
    ],
    "max_range_size": 999
  },
  "state_policies": {
    "content-lifecycle": {
      "allowed": [
        "draft",
        "proposed",
        "confirmed",
        "rejected",
        "superseded",
        "retired"
      ],
      "active": [
        "confirmed"
      ],
      "pending": [
        "draft",
        "proposed"
      ],
      "inactive": [
        "rejected",
        "superseded",
        "retired"
      ]
    },
    "open-point": {
      "allowed": [
        "open",
        "blocked",
        "resolved",
        "superseded",
        "retired"
      ],
      "active": [
        "resolved"
      ],
      "pending": [
        "open",
        "blocked"
      ],
      "inactive": [
        "superseded",
        "retired"
      ]
    },
    "test-plan": {
      "allowed": [
        "draft",
        "proposed",
        "planned",
        "confirmed",
        "superseded",
        "retired"
      ],
      "active": [
        "planned",
        "confirmed"
      ],
      "pending": [
        "draft",
        "proposed"
      ],
      "inactive": [
        "superseded",
        "retired"
      ]
    },
    "risk-lifecycle": {
      "allowed": [
        "draft",
        "proposed",
        "confirmed",
        "open",
        "blocked",
        "accepted",
        "mitigated",
        "resolved",
        "superseded",
        "retired"
      ],
      "active": [
        "confirmed",
        "open",
        "blocked",
        "accepted",
        "mitigated"
      ],
      "pending": [
        "draft",
        "proposed"
      ],
      "inactive": [
        "resolved",
        "superseded",
        "retired"
      ]
    },
    "governance-lifecycle": {
      "allowed": [
        "proposed",
        "confirmed",
        "superseded",
        "retired"
      ],
      "active": [
        "confirmed"
      ],
      "pending": [
        "proposed"
      ],
      "inactive": [
        "superseded",
        "retired"
      ]
    },
    "plan-lifecycle": {
      "allowed": [
        "draft",
        "proposed",
        "confirmed",
        "active",
        "completed",
        "superseded",
        "retired"
      ],
      "active": [
        "confirmed",
        "active",
        "completed"
      ],
      "pending": [
        "draft",
        "proposed"
      ],
      "inactive": [
        "superseded",
        "retired"
      ]
    },
    "release-lifecycle": {
      "allowed": [
        "draft",
        "planned",
        "active",
        "frozen",
        "released",
        "withdrawn",
        "retired"
      ],
      "active": [
        "planned",
        "active",
        "frozen",
        "released"
      ],
      "pending": [
        "draft"
      ],
      "inactive": [
        "withdrawn",
        "retired"
      ]
    },
    "task-workflow": {
      "allowed": [
        "backlog",
        "ready",
        "in-progress",
        "in-review",
        "done",
        "blocked",
        "cancelled"
      ],
      "active": [
        "ready",
        "in-progress",
        "in-review",
        "done"
      ],
      "pending": [
        "backlog",
        "blocked"
      ],
      "inactive": [
        "cancelled"
      ]
    },
    "planning-lifecycle": {
      "allowed": [
        "proposed",
        "confirmed",
        "superseded",
        "retired"
      ],
      "active": [
        "confirmed"
      ],
      "pending": [
        "proposed"
      ],
      "inactive": [
        "superseded",
        "retired"
      ]
    },
    "authorization-lifecycle": {
      "allowed": [
        "authorized",
        "invalidated",
        "revoked"
      ],
      "active": [
        "authorized"
      ],
      "pending": [],
      "inactive": [
        "invalidated",
        "revoked"
      ]
    },
    "planning-change-lifecycle": {
      "allowed": [
        "proposed",
        "confirmed",
        "superseded",
        "retired"
      ],
      "active": [
        "confirmed"
      ],
      "pending": [
        "proposed"
      ],
      "inactive": [
        "superseded",
        "retired"
      ]
    },
    "tracking-binding-lifecycle": {
      "allowed": [
        "proposed",
        "confirmed"
      ],
      "active": [
        "confirmed"
      ],
      "pending": [
        "proposed"
      ],
      "inactive": []
    },
    "tracking-mapping-lifecycle": {
      "allowed": [
        "unlinked",
        "pending",
        "synced",
        "out-of-sync",
        "conflict",
        "failed",
        "reconciliation-required"
      ],
      "active": [
        "synced"
      ],
      "pending": [
        "unlinked",
        "pending",
        "out-of-sync",
        "failed",
        "reconciliation-required"
      ],
      "inactive": [
        "conflict"
      ]
    },
    "tracking-operation-lifecycle": {
      "allowed": [
        "authorized",
        "recorded",
        "failed",
        "conflict",
        "reconciliation-required"
      ],
      "active": [
        "recorded"
      ],
      "pending": [
        "authorized",
        "failed",
        "reconciliation-required"
      ],
      "inactive": [
        "conflict"
      ]
    },
    "reporting-policy-lifecycle": {
      "allowed": [
        "proposed",
        "confirmed",
        "paused"
      ],
      "active": [
        "confirmed",
        "paused"
      ],
      "pending": [
        "proposed"
      ],
      "inactive": []
    },
    "epistemic-adoption": {
      "allowed": [
        "fact",
        "observation",
        "inference",
        "assumption",
        "unknown",
        "contradicted"
      ],
      "active": [
        "fact",
        "observation",
        "inference",
        "assumption",
        "unknown",
        "contradicted"
      ],
      "pending": [],
      "inactive": []
    }
  },
  "artifacts": {
    "ART-STATUS": {
      "artifact_type": "project-status",
      "path": "docs/lks-sdd/00-control/project-status.md",
      "required": true,
      "tables": [
        {
          "id": "status.summary",
          "schemas": [
            "1.0",
            "1.1"
          ],
          "headers": [
            "Ruta",
            "Fase",
            "Puerta",
            "Incremento activo",
            "Readiness",
            "Próximo paso"
          ],
          "min_occurs": 1,
          "max_occurs": 1
        },
        {
          "id": "status.coverage",
          "schemas": [
            "1.1"
          ],
          "headers": [
            "Dimensión",
            "Estado",
            "Alcance",
            "Información disponible",
            "Falta profundizar",
            "Impacto"
          ],
          "min_occurs": 1,
          "max_occurs": 1
        }
      ]
    },
    "ART-SCOPE": {
      "artifact_type": "scope-register",
      "path": "docs/lks-sdd/00-control/scope-register.md",
      "required": true,
      "tables": []
    },
    "ART-OPEN": {
      "artifact_type": "open-points",
      "path": "docs/lks-sdd/00-control/open-points.md",
      "required": true,
      "tables": [
        {
          "id": "control.open-points",
          "schemas": [
            "1.0",
            "1.1"
          ],
          "headers": [
            "ID",
            "State",
            "Question",
            "Impact",
            "Scope",
            "Blocking"
          ],
          "min_occurs": 1,
          "max_occurs": 1,
          "key": {
            "column": "ID",
            "prefixes": [
              "OPEN"
            ]
          },
          "state": {
            "column": "State",
            "policy": "open-point"
          }
        }
      ]
    },
    "ART-BRIEF": {
      "artifact_type": "product-brief",
      "path": "docs/lks-sdd/01-context/product-brief.md",
      "required": true,
      "tables": []
    },
    "ART-CONSTRAINTS": {
      "artifact_type": "constraints",
      "path": "docs/lks-sdd/01-context/constraints.md",
      "required": true,
      "tables": [
        {
          "id": "context.constraints",
          "schemas": [
            "1.0",
            "1.1"
          ],
          "headers": [
            "ID",
            "State",
            "Type",
            "Statement",
            "Source",
            "Impact"
          ],
          "min_occurs": 1,
          "max_occurs": 1,
          "key": {
            "column": "ID",
            "prefixes": [
              "CON"
            ]
          },
          "state": {
            "column": "State",
            "policy": "content-lifecycle"
          }
        }
      ]
    },
    "ART-STAKEHOLDERS": {
      "artifact_type": "stakeholders-and-users",
      "path": "docs/lks-sdd/01-context/stakeholders-and-users.md",
      "required": false,
      "tables": [
        {
          "id": "context.stakeholders",
          "schemas": [
            "1.0",
            "1.1"
          ],
          "headers": [
            "ID",
            "State",
            "Role or profile",
            "Need",
            "Authority",
            "Source"
          ],
          "min_occurs": 1,
          "max_occurs": 1,
          "key": {
            "column": "ID",
            "prefixes": [
              "STK",
              "USR"
            ]
          },
          "state": {
            "column": "State",